
Spring,2010,JACK BEUTH, Carnegie Institute of Technology,12776,INTRO TO SOLIDS II,A,Lect,10,10,100%,6.80,4.90,4.80,4.90,4.40,4.60,4.60,4.90,4.80,4.80,,,,,,,,,,,

Spring,2010,IRVING OPPENHEIM, Carnegie Institute of Technology,FA14-12-100,INTRO CIV & ENV ENG,A,Lect,25,48,52%,5.72,3.32,3.24,3.44,2.64,3.36,3.32,3.20,3.00,3.12,,,,,,,,,,,

Spring,2010,ALAN JACOBS, Carnegie Institute of Technology,FA14-12-201,GEOLOGY,A,Lect,16,23,70%,4.81,4.31,3.81,4.00,3.44,4.00,4.06,4.69,3.88,3.94,,,,,,,,,,,

Spring,2010,ENRIQUE BAZAN, Carnegie Institute of Technology,FA14-12-636,GEOTECHNICAL ENGINR,A,Lect,11,12,92%,5.30,4.36,3.36,3.64,3.64,4.18,4.09,4.55,3.64,3.55,,,,,,,,,,,

Spring,2010,CRAIG MALONEY, Carnegie Institute of Technology,FA14-12-701,MTHMTCL TCH ENGNG,A,Lect,7,8,88%,9.71,4.57,5.00,4.71,4.71,5.00,4.71,5.00,4.57,4.57,,,,,,,,,,,

Spring,2010,DAVID DZOMBAK, Carnegie Institute of Technology,FA14-12-794,GRADUATE SEMINAR,A,Lect,27,48,56%,2.33,4.46,4.50,4.40,4.28,4.31,4.27,4.67,4.54,4.19,,,,,,,,,,,

Spring,2010,SUSAN FINGER, Carnegie Institute of Technology,FA14-12-794,GRADUATE SEMINAR,B,Lect,25,39,64%,2.12,4.28,4.24,4.20,4.16,4.16,4.24,4.48,4.40,3.96,,,,,,,,,,,

Spring,2010,JACOBO BIELAK, Carnegie Institute of Technology,FA14-12-794,GRADUATE SEMINAR,C,Lect,15,19,79%,2.21,4.47,4.33,4.33,4.33,4.33,4.27,4.33,4.33,4.33,,,,,,,,,,,

Spring,2010,CHRIS HENDRICKSON, Carnegie Institute of Technology,FA14-12-794,GRADUATE SEMINAR,D,Lect,8,19,42%,2.00,3.57,3.86,3.71,3.57,3.43,3.57,3.57,3.57,3.57,,,,,,,,,,,

Spring,2010,MICHAEL DOMACH, Carnegie Institute of Technology,06100,INTRO TO CHEM ENGR,1,Lect,21,35,60%,6.14,4.62,4.10,4.05,4.29,4.33,4.00,4.71,4.14,4.05,,,,,,,,,,,

Spring,2010,JAMES SCHNEIDER, Carnegie Institute of Technology,06261,FLUID MECHANICS,A,Lect,35,74,47%,9.20,4.60,4.47,4.57,4.21,4.51,4.43,4.60,4.54,4.37,,,,,,,,,,,

Spring,2010,MYUNG JHON, Carnegie Institute of Technology,06262,MATH MTHDS CHEM ENGR,A,Lect,38,74,51%,8.87,3.50,3.37,3.45,3.00,3.36,3.03,3.76,2.92,3.03,,,,,,,,,,,

Spring,2010,LORENZ BIEGLER, Carnegie Institute of Technology,06361,UNIT OP CHEMICAL ENG,A,Lect,29,60,48%,7.79,3.34,3.68,3.79,3.17,3.86,3.21,4.17,3.03,3.28,,,,,,,,,,,

Spring,2010,B ERIK YDSTIE, Carnegie Institute of Technology,06362,CHEM ENG PROCSS CTRL,A,Lect,29,57,51%,8.72,4.72,4.17,4.31,4.34,4.57,4.21,4.93,4.46,4.50,,,,,,,,,,,

Spring,2010,PAUL SIDES, Carnegie Institute of Technology,06363,TRANSPORT PROCSS LAB,1,Lect,29,54,54%,9.03,3.79,3.10,3.31,2.83,3.28,3.21,3.72,3.03,2.93,,,,,,,,,,,

Spring,2010,NIKOLAOS SAHINIDIS, Carnegie Institute of Technology,06462,OPTM MDG & ALGRTHMS,A3,Lect,23,77,30%,7.48,3.32,3.43,3.61,2.96,3.78,3.30,3.91,3.39,3.35,,,,,,,,,,,

Spring,2010,NIKOLAOS SAHINIDIS, Carnegie Institute of Technology,06463,CHEMICAL PRDT DESIGN,A4,Lect,25,76,33%,4.64,3.64,3.56,3.60,3.68,4.08,3.60,4.08,3.64,3.32,,,,,,,,,,,

Spring,2010,JACOBSON, A.  (co-taught), Carnegie Institute of Technology,06466,EXPERMTL POLYMER SCI,A,Lect,2,5,40%,5.00,5.00,5.00,5.00,3.00,4.00,4.00,5.00,4.00,4.00,,,,,,,,,,,

Spring,2010,FROLLINI, R.  (co-taught), Carnegie Institute of Technology,06466,EXPERMTL POLYMER SCI,A,Lect,2,5,40%,5.00,3.00,5.00,5.00,4.00,5.00,5.00,5.00,4.00,5.00,,,,,,,,,,,

Spring,2010,KRIS DAHL, Carnegie Institute of Technology,06500,SPECIAL TOPICS,A,Lect,2,2,100%,5.00,5.00,5.00,5.00,5.00,5.00,5.00,5.00,5.00,5.00,,,,,,,,,,,

Spring,2010,DENNIS PRIEVE, Carnegie Institute of Technology,06607,PHYS CHEM COLL SURF,A,Lect,22,34,65%,9.64,4.27,4.50,4.09,3.68,4.27,4.27,4.68,4.36,4.00,,,,,,,,,,,

Spring,2010,NEIL DONAHUE, Carnegie Institute of Technology,06620,GLOBAL ATMOS CHMSTRY,A,Lect,14,19,74%,6.07,4.29,3.64,4.07,3.38,4.50,4.43,4.50,4.29,4.14,,,,,,,,,,,

Spring,2010,TODD PRZYBYCIEN, Carnegie Institute of Technology,06622,BIOPROCESS DESIGN,A,Lect,2,2,100%,8.00,3.50,4.00,4.00,4.00,4.00,4.00,4.00,3.00,3.00,,,,,,,,,,,

Spring,2010,ANDREW GELLMAN, Carnegie Institute of Technology,06702,ADVANCED KINETICS,A,Lect,9,14,64%,7.33,3.67,4.11,4.00,3.33,4.11,4.13,4.22,3.89,3.67,,,,,,,,,,,

Spring,2010,MYUNG JHON, Carnegie Institute of Technology,06704,ADV HEAT MASS TRANS,A,Lect,20,25,80%,7.85,3.35,3.75,3.75,3.45,4.15,3.80,4.15,3.75,3.45,,,,,,,,,,,

Spring,2010,JOHN KITCHIN, Carnegie Institute of Technology,06714,SURFACES & ADSORPTN,A,Lect,2,4,50%,8.00,4.50,4.00,4.50,4.50,4.50,4.50,4.50,4.50,5.00,,,,,,,,,,,

Spring,2010,IGNACIO GROSSMANN, Carnegie Institute of Technology,06720,ADV PROC SYS ENGIN,A,Lect,10,17,59%,12.20,4.50,4.70,4.60,4.30,4.50,4.70,4.90,4.80,4.90,,,,,,,,,,,

Spring,2010,JACOBSON, A.  (co-taught), Carnegie Institute of Technology,06777,CPS LAB III,A,Lect,1,2,50%,2.00,5.00,5.00,5.00,5.00,5.00,5.00,5.00,5.00,5.00,,,,,,,,,,,

Spring,2010,STEPPAN, S.  (co-taught), Carnegie Institute of Technology,06777,CPS LAB III,B,Lect,1,2,50%,14.00,5.00,5.00,5.00,5.00,5.00,5.00,5.00,5.00,5.00,,,,,,,,,,,

Spring,2010,LORENZ BIEGLER, Carnegie Institute of Technology,06815,SPECIAL TOPICS,A,Lect,6,9,67%,12.50,4.67,4.67,4.83,4.33,4.83,4.67,4.83,4.83,4.67,,,,,,,,,,,

Spring,2010,MICHAEL LANCET, Carnegie Institute of Technology,39200,BUSINESS FOR ENGNEER,A,Lect,13,27,48%,3.62,4.54,4.08,4.31,4.46,4.15,4.08,4.23,4.31,4.00,,,,,,,,,,,

Spring,2010,MICHAEL LANCET, Carnegie Institute of Technology,39200,BUSINESS FOR ENGNEER,B,Lect,11,30,37%,5.27,4.91,5.00,5.00,5.00,4.82,4.73,5.00,4.82,4.73,,,,,,,,,,,

Spring,2010,SUSAN FINGER, Carnegie Institute of Technology,39245,RAPID PROTOTYPE DSGN,A,Lect,16,24,67%,4.63,4.88,4.19,4.44,4.31,4.31,4.25,4.94,4.63,4.69,,,,,,,,,,,

Spring,2010,SUSAN FINGER, Carnegie Institute of Technology,39245,RAPID PROTOTYPE DSGN,B,Lect,17,22,77%,5.56,4.88,4.53,4.76,4.53,4.53,4.71,4.82,4.76,4.71,,,,,,,,,,,

Spring,2010,ANDERSON, E.  (co-taught), Carnegie Institute of Technology,39600,INTEG PRODT DEVELPMN,A,Lect,15,18,83%,10.75,4.31,3.77,3.92,3.77,4.15,4.00,4.46,3.77,4.23,,,,,,,,,,,

Spring,2010,CAGAN, J.  (co-taught), Carnegie Institute of Technology,39600,INTEG PRODT DEVELPMN,A,Lect,15,18,83%,10.36,3.93,3.93,3.87,3.73,4.13,3.73,4.13,3.80,3.93,,,,,,,,,,,

Spring,2010,BOATWRIGHT, P.  (co-taught), Carnegie Institute of Technology,39600,INTEG PRODT DEVELPMN,A,Lect,15,18,83%,10.25,4.54,4.31,4.23,4.23,4.31,4.15,4.62,4.31,4.23,,,,,,,,,,,

Spring,2010,JEFFERY HANSEN, Carnegie Institute of Technology,39606,ENGINEERING DSGN PRJ,A,Lect,20,32,63%,6.05,3.65,4.00,3.90,3.55,3.80,3.80,4.40,3.85,4.00,,,,,,,,,,,

Spring,2010,BURAK OZDOGANLAR, Carnegie Institute of Technology,39800,PREP FACULTY CAREER,A,Lect,22,27,81%,2.00,4.62,4.57,4.57,4.33,4.67,4.62,4.67,4.57,4.48,,,,,,,,,,,

Spring,2010,ANNETTE JACOBSON, Carnegie Institute of Technology,39802,COL POLY SUR LAB II,A,Lect,4,9,44%,7.25,5.00,5.00,5.00,5.00,4.75,4.75,5.00,4.75,4.75,,,,,,,,,,,

Spring,2010,ANNETTE JACOBSON, Carnegie Institute of Technology,39802,COL POLY SUR LAB II,B,Lect,4,9,44%,7.25,4.50,4.50,4.25,4.75,4.50,4.50,4.50,4.25,4.25,,,,,,,,,,,

Spring,2010,STEPPAN, S.  (co-taught), Carnegie Institute of Technology,39803,CPS LAB III,B,Lect,1,2,50%,11.00,5.00,5.00,5.00,5.00,5.00,5.00,5.00,5.00,5.00,,,,,,,,,,,

Spring,2010,ZHU, J.  (co-taught), Carnegie Institute of Technology,18100,INTRO ELEC COMP ENG,1,Lect,43,77,56%,9.78,3.84,4.04,3.88,3.56,3.88,3.60,4.20,3.64,3.60,,,,,,,,,,,

Spring,2010,SULLIVAN, T.  (co-taught), Carnegie Institute of Technology,18100,INTRO ELEC COMP ENG,1,Lect,43,77,56%,10.21,4.07,4.21,4.19,3.69,4.36,3.98,4.45,3.90,3.98,,,,,,,,,,,

Spring,2010,JAMES HOBURG, Carnegie Institute of Technology,18202,MATH FNDTN ELEC ENGR,1,Lect,40,77,52%,9.35,4.68,4.62,4.60,4.15,4.63,4.72,4.68,4.68,4.38,,,,,,,,,,,

Spring,2010,DAVID GREVE, Carnegie Institute of Technology,18220,ELETRONC DEVC ANL CR,1,Lect,44,86,51%,7.18,3.52,3.89,3.80,3.27,3.68,3.86,4.02,3.48,3.39,,,,,,,,,,,

Spring,2010,DIANA MARCULESCU, Carnegie Institute of Technology,18240,STRC DES DIGTL SYSTM,1,Lect,43,80,54%,11.28,3.58,4.02,4.09,3.33,4.02,4.16,4.28,3.88,3.67,,,,,,,,,,,

Spring,2010,GREGORY KESDEN, Carnegie Institute of Technology,18243,INTR CMPTR SYSTEMS,1,Lect,17,29,59%,11.18,4.47,4.29,4.29,4.00,4.47,4.35,4.24,4.24,4.18,,,,,,,,,,,

Spring,2010,WILLIAM NACE, Carnegie Institute of Technology,18243,INTR CMPTR SYSTEMS,2,Lect,38,69,55%,11.63,3.84,4.05,4.14,3.63,4.03,4.03,4.37,3.97,3.84,,,,,,,,,,,

Spring,2010,THOMAS SULLIVAN, Carnegie Institute of Technology,18290,SIGNALS & SYSTEMS,1,Lect,26,57,46%,9.62,3.62,3.73,3.69,3.38,4.00,3.73,4.19,3.62,3.73,,,,,,,,,,,

Spring,2010,THOMAS SULLIVAN, Carnegie Institute of Technology,18290,SIGNALS & SYSTEMS,A,Lect,4,19,21%,6.50,4.25,4.00,4.25,3.75,4.00,4.25,4.50,4.25,4.00,,,,,,,,,,,

Spring,2010,JIAN-GANG ZHU, Carnegie Institute of Technology,18310,FUND SEMICONDTOR DEV,1,Lect,26,44,59%,7.31,4.00,4.08,3.84,3.54,4.15,3.69,4.38,3.73,3.65,,,,,,,,,,,

Spring,2010,JEYANANDH PARAMESH, Carnegie Institute of Technology,18321,ANAL/DES ANALOG CIRC,1,Lect,20,35,57%,11.45,3.53,4.00,4.05,3.00,4.00,4.05,4.15,3.65,3.70,,,,,,,,,,,

Spring,2010,RONALD BLANTON, Carnegie Institute of Technology,18340,DIGITAL COMPUTATION,1,Lect,11,19,58%,10.10,4.36,4.45,4.36,3.91,4.64,4.27,4.82,4.36,4.36,,,,,,,,,,,

Spring,2010,DONALD THOMAS, Carnegie Institute of Technology,18341,LOG DES SIM SYN VER,A,Lect,8,17,47%,9.50,4.63,4.63,4.63,4.38,4.75,4.88,4.63,4.75,4.75,,,,,,,,,,,

Spring,2010,HYONG KIM, Carnegie Institute of Technology,18345,INTR TELECOM NETWRKS,A,Lect,8,20,40%,10.25,4.13,4.00,3.63,4.00,4.13,4.38,4.75,3.88,3.75,,,,,,,,,,,

Spring,2010,VIJAYAKUMAR BHAGAVATULA, Carnegie Institute of Technology,18391,NSY SGNL REPR PRCSG,1,Lect,12,15,80%,9.00,4.25,4.42,4.42,4.25,4.50,4.42,4.42,4.42,4.42,,,,,,,,,,,

Spring,2010,THOMAS SULLIVAN, Carnegie Institute of Technology,18396,SIGNALS AND SYSTEMS,1,Lect,19,34,56%,9.74,3.68,4.06,3.68,3.32,3.68,3.68,4.42,3.63,3.37,,,,,,,,,,,

Spring,2010,JAMES BAIN, Carnegie Institute of Technology,18402,APPLIED ELECTRODYNMC,A,Lect,10,10,100%,10.70,4.90,4.70,4.70,4.40,4.70,4.70,5.00,4.70,4.50,,,,,,,,,,,

Spring,2010,ELIAS TOWE, Carnegie Institute of Technology,18411,COMP TECHNIQUES ENG,A,Lect,1,2,50%,5.00,3.00,3.00,3.00,4.00,4.00,4.00,4.00,4.00,4.00,,,,,,,,,,,

Spring,2010,WOJCIECH MALY, Carnegie Institute of Technology,18415,DES MRKT DEEP SUB IC,A,Lect,2,3,67%,5.00,5.00,3.50,5.00,5.00,5.00,4.50,4.50,4.50,4.50,,,,,,,,,,,

Spring,2010,JAMES HOE, Carnegie Institute of Technology,18447,INTRO COMPUTER ARCH,1,Lect,25,46,54%,10.76,4.36,4.32,4.24,3.88,4.44,4.44,4.44,4.12,4.28,,,,,,,,,,,

Spring,2010,BRUCE KROGH, Carnegie Institute of Technology,18474,EMBED CONTROL SYSTMS,1,Lect,6,10,60%,10.50,4.67,4.33,4.17,4.17,4.67,4.17,4.83,4.50,4.50,,,,,,,,,,,

Spring,2010,MARVIN SIRBU, Carnegie Institute of Technology,18482,TELCOM TCH POL & MGT,A,Lect,6,12,50%,7.50,3.50,3.33,3.83,3.50,4.17,3.83,4.00,3.50,3.33,,,,,,,,,,,

Spring,2010,DAVID LAMBETH, Carnegie Institute of Technology,18510,SENSOR SYSTEMS DESGN,A,Lect,11,20,55%,10.45,4.82,4.09,4.27,4.64,4.36,4.64,4.73,4.64,4.55,,,,,,,,,,,

Spring,2010,SIEWIOREK, D.  (co-taught), Carnegie Institute of Technology,18540,RAPID PROTOTYPING,1,Lect,4,7,57%,9.50,3.75,3.75,3.75,3.75,3.75,3.75,4.25,3.75,3.50,,,,,,,,,,,

Spring,2010,SMAILAGIC, A.  (co-taught), Carnegie Institute of Technology,18540,RAPID PROTOTYPING,1,Lect,4,7,57%,8.00,4.00,4.00,4.00,4.50,4.00,4.00,4.50,4.00,4.00,,,,,,,,,,,

Spring,2010,GANDHI, R.  (co-taught), Carnegie Institute of Technology,18549,EMBEDDED SYSTMS DESN,1,Lect,27,45,60%,10.09,4.00,3.91,4.04,4.04,4.09,3.87,4.30,3.96,4.30,,,,,,,,,,,

Spring,2010,NARASIMHAN, P.  (co-taught), Carnegie Institute of Technology,18549,EMBEDDED SYSTMS DESN,1,Lect,27,45,60%,9.56,4.63,4.48,4.59,4.63,4.70,4.44,4.74,4.48,4.52,,,,,,,,,,,

Spring,2010,NEUMAN, C.  (co-taught), Carnegie Institute of Technology,18578,MECHATRONIC DESIGN,1,Lect,14,25,56%,12.62,4.00,4.07,4.14,3.79,4.00,4.00,4.64,4.07,4.07,,,,,,,,,,,

Spring,2010,DOLAN, J.  (co-taught), Carnegie Institute of Technology,18578,MECHATRONIC DESIGN,1,Lect,14,25,56%,12.75,4.25,4.08,4.17,3.92,4.17,4.08,4.58,4.09,4.08,,,,,,,,,,,

Spring,2010,YI LUO, Carnegie Institute of Technology,18615,MICRO NANO SYS FAB,1,Lect,18,23,78%,9.17,4.39,4.17,4.39,4.06,4.61,4.50,4.72,4.28,4.33,,,,,,,,,,,

Spring,2010,MARIJA ILIC, Carnegie Institute of Technology,18618,SMT GR FT EL EN SYS,1,Lect,11,14,79%,10.73,4.55,4.27,4.36,4.09,4.45,4.36,4.73,4.36,4.27,,,,,,,,,,,

Spring,2010,KENNETH MAI, Carnegie Institute of Technology,18622,ADV DIGTL IC DESIGN,A,Lect,18,26,69%,12.50,4.50,4.39,4.50,4.28,4.61,4.56,4.56,4.44,4.28,,,,,,,,,,,

Spring,2010,ALYSSON BESSANI, Carnegie Institute of Technology,18639,SPEC TOPCS SECURITY,PP,Lect,9,9,100%,10.33,3.00,3.00,3.11,2.78,3.00,3.11,3.78,2.67,2.67,,,,,,,,,,,

Spring,2010,PHILIP KOOPMAN, Carnegie Institute of Technology,18649,DISTRIB EMBED SYSTMS,A,Lect,31,46,67%,13.30,4.61,4.65,4.58,4.32,4.65,4.58,4.71,4.65,4.58,,,,,,,,,,,

Spring,2010,BYRON YU, Carnegie Institute of Technology,18699,SP TPCS: SIGNL PRCSG,A,Lect,14,18,78%,10.36,4.71,4.43,4.57,4.07,4.64,4.79,4.71,4.71,4.71,,,,,,,,,,,

Spring,2010,L. CARLEY, Carnegie Institute of Technology,18723,RFIC DESGN IMPLEMENT,1,Lect,10,17,59%,12.50,4.70,4.60,4.60,4.20,4.70,4.40,4.90,4.60,4.50,,,,,,,,,,,

Spring,2010,ADRIAN PERRIG, Carnegie Institute of Technology,18731,NETWORK SECURITY,A,Lect,36,50,72%,10.25,4.72,4.61,4.69,4.20,4.72,4.75,4.67,4.67,4.69,,,,,,,,,,,

Spring,2010,ADRIAN PERRIG, Carnegie Institute of Technology,18731,NETWORK SECURITY,PP,Lect,10,11,91%,12.50,5.00,4.70,4.80,4.40,4.90,5.00,4.90,5.00,5.00,,,,,,,,,,,

Spring,2010,MIGUEL CORREIA, Carnegie Institute of Technology,18732,SECURE SOFTWR SYSTMS,PP,Lect,10,11,91%,9.20,4.70,4.90,4.80,4.60,4.80,4.80,5.00,5.00,4.90,,,,,,,,,,,

Spring,2010,VIRGIL GLIGOR, Carnegie Institute of Technology,18733,APPLIED CRYPTOGRAPHY,1,Lect,8,12,67%,9.13,4.50,4.00,4.00,3.88,4.63,4.25,4.88,4.38,4.13,,,,,,,,,,,

Spring,2010,ONUR MUTLU, Carnegie Institute of Technology,18742,PARALLEL CMPTR ARCHT,A,Lect,18,20,90%,8.83,4.56,4.44,4.56,4.17,4.72,4.78,4.61,4.44,4.24,,,,,,,,,,,

Spring,2010,SIEWIOREK, D.  (co-taught), Carnegie Institute of Technology,18745,RAP PROTYP COMP SYS,1,Lect,10,20,50%,8.90,3.30,3.30,3.30,3.30,3.00,3.10,3.90,3.30,3.20,,,,,,,,,,,

Spring,2010,SMAILAGIC, A.  (co-taught), Carnegie Institute of Technology,18745,RAP PROTYP COMP SYS,1,Lect,10,20,50%,9.33,3.50,3.40,3.40,3.50,3.30,3.40,3.90,3.40,3.50,,,,,,,,,,,

Spring,2010,GIBSON, G.  (co-taught), Carnegie Institute of Technology,18746,ADV STORAGE SYSTEMS,A,Lect,29,41,71%,9.03,4.66,4.66,4.59,4.24,4.76,4.66,4.66,4.62,4.69,,,,,,,,,,,

Spring,2010,GANGER, G.  (co-taught), Carnegie Institute of Technology,18746,ADV STORAGE SYSTEMS,A,Lect,29,41,71%,8.50,4.83,4.78,4.83,4.53,4.83,4.78,4.83,4.83,4.72,,,,,,,,,,,

Spring,2010,RAGUNATHAN RAJKUMAR, Carnegie Institute of Technology,18748,WIRELSS SENSOR NTWKS,A,Lect,22,30,73%,11.14,4.00,4.09,3.86,3.77,3.95,3.90,4.27,3.57,3.64,,,,,,,,,,,

Spring,2010,JOSE MOURA, Carnegie Institute of Technology,18752,ESTIM DETECT IDENT,A,Lect,3,5,60%,12.00,4.33,4.67,4.33,4.33,4.33,5.00,4.67,5.00,4.67,,,,,,,,,,,

Spring,2010,PAULO OLIVIERA, Carnegie Institute of Technology,18752,ESTIM DETECT IDENT,PP,Lect,1,3,33%,5.00,5.00,5.00,5.00,5.00,5.00,5.00,4.00,5.00,5.00,,,,,,,,,,,

Spring,2010,ROHIT NEGI, Carnegie Institute of Technology,18753,INFORMTION THEORY,A,Lect,10,15,67%,8.30,4.50,4.80,4.70,4.20,4.60,4.60,4.56,4.30,4.30,,,,,,,,,,,

Spring,2010,PETER STEENKISTE, Carnegie Institute of Technology,18759,WIRELESS NETWORKS,1,Lect,17,27,63%,9.06,4.24,4.41,4.06,3.94,4.06,4.06,4.35,3.94,4.00,,,,,,,,,,,

Spring,2010,PETER STEENKISTE, Carnegie Institute of Technology,18759,WIRELESS NETWORKS,A,Lect,14,27,52%,8.92,4.21,4.43,4.29,3.79,3.93,4.14,4.57,3.93,3.86,,,,,,,,,,,

Spring,2010,RUI AGUIAR, Carnegie Institute of Technology,18759,WIRELESS NETWORKS,PP,Lect,2,5,40%,14.00,4.50,3.50,4.00,4.00,4.00,4.00,4.50,4.50,4.50,,,,,,,,,,,

Spring,2010,LAWRENCE PILEGGI, Carnegie Institute of Technology,18762,CIRCUIT SIMUATION  R,A,Lect,9,13,69%,9.00,4.78,4.78,4.67,4.56,4.56,5.00,4.56,4.78,4.78,,,,,,,,,,,

Spring,2010,ANDRZEJ STROJWAS, Carnegie Institute of Technology,18769,DSG MNFCT NMTR ERA,A,Lect,7,7,100%,10.57,4.71,4.43,4.43,4.71,4.57,4.57,4.86,4.71,4.29,,,,,,,,,,,

Spring,2010,JOHN GALEOTTI, Carnegie Institute of Technology,18791,MEDICAL IMAGING ANAL,A,Lect,6,9,67%,7.00,4.50,4.33,4.33,4.67,4.83,4.83,4.83,4.83,4.67,,,,,,,,,,,

Spring,2010,RICHARD STERN, Carnegie Institute of Technology,18792,ADV DIGTL SIGNL PRCS,1,Lect,7,11,64%,12.71,4.29,4.29,4.14,4.00,4.14,4.29,4.43,4.29,4.29,,,,,,,,,,,

Spring,2010,MARIOS SAVVIDES, Carnegie Institute of Technology,18794,PATTERN RECOGNTN THY,A,Lect,35,42,83%,10.40,4.71,4.37,4.49,4.51,4.60,4.63,4.60,4.60,4.63,,,,,,,,,,,

Spring,2010,GE YANG, Carnegie Institute of Technology,18795,BIOIMAGE INFORMATICS,A,Lect,10,13,77%,9.67,4.60,4.40,4.90,4.60,4.90,4.80,4.90,4.60,4.50,,,,,,,,,,,

Spring,2010,JOAO XAVIER, Carnegie Institute of Technology,18799,SP TPC SIGNAL PROCSS,B,Lect,2,3,67%,8.00,5.00,5.00,5.00,5.00,5.00,5.00,5.00,5.00,5.00,,,,,,,,,,,

Spring,2010,BHIKSHA RAMAKRISHNAN, Carnegie Institute of Technology,18799,SP TPC SIGNAL PROCSS,D,Lect,2,5,40%,11.00,4.00,2.00,3.00,3.50,3.50,2.50,4.50,3.00,3.00,,,,,,,,,,,

Spring,2010,JOAO XAVIER, Carnegie Institute of Technology,18799,SP TPC SIGNAL PROCSS,PP,Lect,2,4,50%,9.50,5.00,5.00,5.00,5.00,5.00,5.00,5.00,5.00,5.00,,,,,,,,,,,

Spring,2010,WILLIAM NACE, Carnegie Institute of Technology,18842,DISTRIBUTED SYSTEMS,A,Lect,66,68,97%,9.27,4.30,4.21,4.23,3.95,4.12,3.89,4.58,3.79,3.86,,,,,,,,,,,

Spring,2010,LAZAROS POLYMENAKOS, Carnegie Institute of Technology,18842,DISTRIBUTED SYSTEMS,G,Lect,11,14,79%,11.82,3.64,3.91,3.91,3.36,4.27,3.73,3.73,3.64,3.82,,,,,,,,,,,

Spring,2010,WILLIAM NACE, Carnegie Institute of Technology,18842,DISTRIBUTED SYSTEMS,PP,Lect,4,5,80%,14.00,5.00,4.50,4.50,4.50,4.50,4.75,5.00,4.75,4.25,,,,,,,,,,,

Spring,2010,OZAN TONGUZ, Carnegie Institute of Technology,18859,SP TPC IN COMMUNCTN,H,Lect,7,12,58%,9.71,4.57,4.57,4.57,3.71,4.57,4.00,4.43,3.86,3.86,,,,,,,,,,,

Spring,2010,FONTES, F.  (co-taught), Carnegie Institute of Technology,18859,SP TPC IN COMMUNCTN,PP,Lect,2,4,50%,14.00,5.00,4.50,5.00,4.50,5.00,4.50,5.00,4.50,4.50,,,,,,,,,,,

Spring,2010,SALVADOR, P.  (co-taught), Carnegie Institute of Technology,18859,SP TPC IN COMMUNCTN,PP,Lect,2,4,50%,14.00,5.00,5.00,5.00,5.00,5.00,5.00,5.00,5.00,5.00,,,,,,,,,,,

Spring,2010,RADU MARCULESCU, Carnegie Institute of Technology,18869,WLD CR ID EL CMP ENG,D,Lect,14,15,93%,8.86,4.64,4.00,4.14,4.14,4.43,4.21,4.57,4.21,4.29,,,,,,,,,,,

Spring,2010,ILIC, M.  (co-taught), Carnegie Institute of Technology,18875,ENG ECON EL ENGY SYS,1,Lect,12,16,75%,7.67,4.44,4.33,4.22,4.11,4.56,4.44,4.56,4.44,4.56,,,,,,,,,,,

Spring,2010,LAVE, L.  (co-taught), Carnegie Institute of Technology,18875,ENG ECON EL ENGY SYS,1,Lect,12,16,75%,7.75,4.25,4.25,4.17,4.08,4.50,4.25,4.42,4.25,4.33,,,,,,,,,,,

Spring,2010,ISHIHARA, A.  (co-taught), Carnegie Institute of Technology,18879,SP TPCS SYSTMS CONTR,K,Lect,2,2,100%,8.00,5.00,5.00,4.50,5.00,5.00,5.00,5.00,5.00,5.00,,,,,,,,,,,

Spring,2010,BEN-MENAHEM, S.  (co-taught), Carnegie Institute of Technology,18879,SP TPCS SYSTMS CONTR,K,Lect,2,2,100%,8.00,4.00,5.00,5.00,3.00,4.00,3.00,5.00,3.00,5.00,,,,,,,,,,,

Spring,2010,BRUNO SINOPOLI, Carnegie Institute of Technology,18879,SP TPCS SYSTMS CONTR,S,Lect,8,9,89%,8.00,3.63,3.25,3.25,3.00,3.75,3.13,4.13,3.50,3.00,,,,,,,,,,,

Spring,2010,ISHIHARA, A.  (co-taught), Carnegie Institute of Technology,18879,SP TPCS SYSTMS CONTR,SV,Lect,5,7,71%,11.00,5.00,4.60,4.40,4.20,4.60,4.80,5.00,4.40,4.40,,,,,,,,,,,

Spring,2010,BEN-MENAHEM, S.  (co-taught), Carnegie Institute of Technology,18879,SP TPCS SYSTMS CONTR,SV,Lect,5,7,71%,12.00,4.67,4.67,4.00,3.67,4.33,4.67,5.00,4.00,4.00,,,,,,,,,,,

Spring,2010,MARK KIELER, Carnegie Institute of Technology,19101,INTRO ENGR & PUB POL,1,Lect,75,134,56%,4.01,4.40,4.41,4.32,4.20,4.47,4.37,4.61,4.29,4.13,,,,,,,,,,,

Spring,2010,MARVIN SIRBU, Carnegie Institute of Technology,19402,TELCOM TCH POL & MGT,A,Lect,2,3,67%,8.00,3.00,3.00,2.00,2.00,3.50,3.50,4.00,2.00,2.00,,,,,,,,,,,

Spring,2010,CRANOR, L.  (co-taught), Carnegie Institute of Technology,19451,EPP PROJECT,A,Lect,10,21,48%,8.60,3.70,3.80,3.30,4.00,3.90,3.60,4.20,3.70,3.60,,,,,,,,,,,

Spring,2010,CASMAN, E.  (co-taught), Carnegie Institute of Technology,19451,EPP PROJECT,A,Lect,10,21,48%,10.00,4.33,3.33,3.67,4.33,4.00,3.67,4.33,3.67,4.00,,,,,,,,,,,

Spring,2010,MATTHEWS, H.  (co-taught), Carnegie Institute of Technology,19451,EPP PROJECT,B,Lect,12,20,60%,11.75,3.92,3.67,3.50,4.08,4.00,3.25,4.50,4.00,3.75,,,,,,,,,,,

Spring,2010,FISCHBECK, P.  (co-taught), Carnegie Institute of Technology,19451,EPP PROJECT,B,Lect,12,20,60%,12.13,4.00,3.63,3.50,3.75,4.38,3.50,4.25,4.00,3.88,,,,,,,,,,,

Spring,2010,MICHALEK, J.  (co-taught), Carnegie Institute of Technology,19484,DEC TLS ENG DES ENTR,A,Lect,5,6,83%,10.40,4.20,4.00,4.20,4.00,4.40,3.80,4.40,4.20,4.00,,,,,,,,,,,

Spring,2010,FUCHS, E.  (co-taught), Carnegie Institute of Technology,19484,DEC TLS ENG DES ENTR,A,Lect,5,6,83%,11.00,4.20,3.80,4.00,4.00,4.00,3.40,4.20,3.80,3.80,,,,,,,,,,,

Spring,2010,BENOIT MOREL, Carnegie Institute of Technology,19601,INFORMATION WARFARE,A,Lect,92,192,48%,4.46,4.20,3.65,3.93,3.54,4.37,4.16,4.41,3.87,3.87,,,,,,,,,,,

Spring,2010,MATTHEWS, H.  (co-taught), Carnegie Institute of Technology,19614,ENV LFE CYC AS GR DS,A3,Lect,5,10,50%,11.00,3.80,3.40,3.20,3.00,3.80,3.40,4.00,3.20,2.80,,,,,,,,,,,

Spring,2010,WEBER, C.  (co-taught), Carnegie Institute of Technology,19614,ENV LFE CYC AS GR DS,A3,Lect,5,10,50%,11.00,3.40,3.40,2.80,3.00,3.60,3.80,4.00,3.20,2.80,,,,,,,,,,,

Spring,2010,COFFELT, D.  (co-taught), Carnegie Institute of Technology,19617,INFRASTRUCTR MNGMNT,A,Lect,2,3,67%,5.00,4.00,4.00,4.00,3.50,5.00,5.00,5.00,4.50,4.50,,,,,,,,,,,

Spring,2010,HENDRICKSON, C.  (co-taught), Carnegie Institute of Technology,19617,INFRASTRUCTR MNGMNT,A,Lect,2,3,67%,5.00,4.00,4.50,4.00,4.50,4.00,4.00,4.50,4.00,4.00,,,,,,,,,,,

Spring,2010,AZEVEDO, I.  (co-taught), Carnegie Institute of Technology,19621,SP TPC:STB EN SY MN,A4,Lect,13,21,62%,7.77,4.54,3.92,4.00,3.23,4.23,4.23,4.77,4.23,3.77,,,,,,,,,,,

Spring,2010,MCCOY, S.  (co-taught), Carnegie Institute of Technology,19621,SP TPC:STB EN SY MN,A4,Lect,13,21,62%,7.75,4.62,3.85,4.00,3.31,4.23,4.23,4.77,4.15,3.85,,,,,,,,,,,

Spring,2010,ADAMS, P.  (co-taught), Carnegie Institute of Technology,19626,CLIMATE SCI & POLICY,A,Lect,18,23,78%,6.67,4.50,4.44,4.44,3.72,4.61,4.33,4.67,4.39,4.22,,,,,,,,,,,

Spring,2010,GROSSMANN, I.  (co-taught), Carnegie Institute of Technology,19626,CLIMATE SCI & POLICY,A,Lect,18,23,78%,6.15,4.42,4.00,4.00,3.75,4.17,4.00,4.67,3.75,4.25,,,,,,,,,,,

Spring,2010,JAY WHITACRE, Carnegie Institute of Technology,19666,SP TPC ENERGY POLICY,A3,Lect,1,8,13%,5.00,5.00,4.00,4.00,5.00,5.00,3.00,5.00,4.00,4.00,,,,,,,,,,,

Spring,2010,HEARD, R.  (co-taught), Carnegie Institute of Technology,19667,SP TPC: MATRLS & SOC,A4,Lect,2,3,67%,6.50,5.00,4.00,4.00,3.00,4.50,4.50,5.00,4.50,4.00,,,,,,,,,,,

Spring,2010,WHITACRE, J.  (co-taught), Carnegie Institute of Technology,19667,SP TPC: MATRLS & SOC,A4,Lect,2,3,67%,6.50,5.00,4.00,4.00,3.00,4.00,4.00,5.00,3.50,4.00,,,,,,,,,,,

Spring,2010,EDEN FISHER, Carnegie Institute of Technology,19680,SPECIAL TOPICS,A,Lect,12,21,57%,4.25,4.92,4.58,4.50,4.33,4.58,4.50,4.83,4.50,4.50,,,,,,,,,,,

Spring,2010,FISHER, E.  (co-taught), Carnegie Institute of Technology,19681,MANAGERIAL ENG ECON,A,Lect,21,31,68%,8.33,3.94,3.94,3.89,3.56,3.94,3.83,3.72,3.94,3.94,,,,,,,,,,,

Spring,2010,KAFKA, F.  (co-taught), Carnegie Institute of Technology,19681,MANAGERIAL ENG ECON,A,Lect,21,31,68%,8.40,4.75,4.75,4.81,4.25,4.75,4.75,4.56,4.80,4.69,,,,,,,,,,,

Spring,2010,FRANCISCO VELOSO, Carnegie Institute of Technology,19682,STRAT MGT TECH INNOV,1,Lect,17,23,74%,8.35,4.53,4.65,4.63,4.18,4.71,4.71,4.71,4.59,4.47,,,,,,,,,,,

Spring,2010,SERGUEY BRAGUINSKY, Carnegie Institute of Technology,19699,SP TPCS INSTN ENTPSH,A,Lect,3,4,75%,8.00,4.67,4.33,4.33,4.33,3.67,3.67,4.67,4.67,4.33,,,,,,,,,,,

Spring,2010,BENOIT MOREL, Carnegie Institute of Technology,19706,OPTIMIZATION,A3,Lect,10,21,48%,7.10,3.80,3.30,3.70,3.40,4.10,3.90,4.70,3.50,3.60,,,,,,,,,,,

Spring,2010,BENOIT MOREL, Carnegie Institute of Technology,19709,ST:REAL OPTIONS,A4,Lect,17,27,63%,5.75,4.41,3.94,4.00,3.82,4.41,4.00,4.59,3.88,4.00,,,,,,,,,,,

Spring,2010,MARVIN SIRBU, Carnegie Institute of Technology,19712,TELCOM TCH POL & MGT,A,Lect,3,3,100%,11.00,3.67,4.00,3.67,3.67,4.00,4.00,4.33,4.00,4.00,,,,,,,,,,,

Spring,2010,MITCHELL SMALL, Carnegie Institute of Technology,19726,MATH MDL ENVRN SYS,A,Lect,6,7,86%,8.50,4.17,4.17,4.17,3.33,4.50,4.50,4.67,4.33,4.00,,,,,,,,,,,

Spring,2010,ILIC, M.  (co-taught), Carnegie Institute of Technology,19734,ENG ECON ELC PWR SYS,1,Lect,9,10,90%,8.00,3.89,3.00,3.22,3.33,4.33,3.78,4.00,3.67,3.78,,,,,,,,,,,

Spring,2010,LAVE, L.  (co-taught), Carnegie Institute of Technology,19734,ENG ECON ELC PWR SYS,1,Lect,9,10,90%,7.63,4.11,3.22,3.78,3.67,4.56,4.22,4.11,4.11,4.00,,,,,,,,,,,

Spring,2010,CRANOR, L.  (co-taught), Carnegie Institute of Technology,19752,EPP PROJECT MGMT,A,Lect,1,3,33%,14.00,5.00,5.00,5.00,5.00,5.00,5.00,5.00,5.00,5.00,,,,,,,,,,,

Spring,2010,MARK KIELER, Carnegie Institute of Technology,19753,EPP TEACHNG PRACTCUM,1,Lect,4,5,80%,7.25,3.25,2.00,2.50,2.75,2.50,1.75,4.00,2.00,2.00,,,,,,,,,,,

Spring,2010,MICHALEK, J.  (co-taught), Carnegie Institute of Technology,19784,SPECIAL TOPICS,A,Lect,17,19,89%,13.12,4.24,3.71,4.29,4.00,3.94,4.12,4.35,3.88,3.88,,,,,,,,,,,

Spring,2010,FUCHS, E.  (co-taught), Carnegie Institute of Technology,19784,SPECIAL TOPICS,A,Lect,17,19,89%,13.25,4.35,3.82,4.12,3.94,4.18,3.76,4.47,3.76,3.82,,,,,,,,,,,

Spring,2010,LOANNIS CHRISTIOUS, Carnegie Institute of Technology,14720,INFRMTN SYSTMS MODLG,G,Lect,8,10,80%,9.13,4.25,4.13,4.00,3.75,4.38,4.38,4.50,4.38,4.13,,,,,,,,,,,

